{
  "$schema": "https://json-schema.org/draft/2020-12/schema",
  "title": "NemCssConfig",
  "description": "NemCssConfig represents the configuration of the NemCSS util.\nIt contains the paths to the content files and the design tokens, as well as the theme configuration.",
  "type": "object",
  "properties": {
    "content": {
      "description": "Vector of glob patterns to determine which content files to target.\nContent files will be used to determine which CSS classes to generate.",
      "type": "array",
      "items": {
        "type": "string"
      }
    },
    "semantic": {
      "description": "Semantic tokens",
      "anyOf": [
        {
          "$ref": "#/$defs/SemanticConfig"
        },
        {
          "type": "null"
        }
      ]
    },
    "theme": {
      "description": "Theme configuration.",
      "anyOf": [
        {
          "$ref": "#/$defs/ThemeConfig"
        },
        {
          "type": "null"
        }
      ]
    },
    "tokensDir": {
      "description": "Path to directory containing the design tokens.",
      "type": "string",
      "default": "design-tokens"
    }
  },
  "additionalProperties": false,
  "required": [
    "content"
  ],
  "$defs": {
    "SemanticConfig": {
      "description": "The semantic config enables the creation of groups of semantic tokens (e.g. for \"text\",\n\"background\") with their own configuration (e.g. the CSS property they target and the tokens\nthey use)",
      "type": "object",
      "additionalProperties": {
        "$ref": "#/$defs/SemanticGroupConfig"
      }
    },
    "SemanticGroupConfig": {
      "description": "A single semantic token config",
      "type": "object",
      "properties": {
        "property": {
          "description": "CSS property this group targets (e.g. \"color\", \"background-color\")",
          "type": "string",
          "minLength": 1
        },
        "tokens": {
          "description": "Mapping between a semantic name and an existing design token value\ne.g. \"primary\" -> \"{colors.blue-800}\"",
          "type": "object",
          "additionalProperties": {
            "type": "string"
          }
        }
      },
      "required": [
        "property",
        "tokens"
      ]
    },
    "ThemeConfig": {
      "description": "ThemeConfig represents the configuration of the theme.\nIt contains the design tokens configuration per token type.",
      "type": "object",
      "additionalProperties": {
        "$ref": "#/$defs/TokenConfig"
      }
    },
    "TokenConfig": {
      "description": "TokenConfig represents the configuration of a single design token.\nYou can override the default configuration by specifying the source, prefix, and utilities.\n\n# Examples\n\nIn your `nemcss.config.json`:\n\n```json\n{\n  \"theme\": {\n     \"colors\": {\n       \"source\": \"design-tokens/colors.json\",\n       \"prefix\": \"color\",\n       \"utilities\": [\n          {\n            \"prefix\": \"highlight\",\n            \"property\": \"background-color\"\n          }\n       ]\n     }\n\n  }\n}\n```\n\nWith a token variant \"primary\" in colors.json, this generates:\n- CSS custom property: `--color-primary`\n- Utility class: `.highlight-primary { background-color: var(--color-primary); }`",
      "type": "object",
      "properties": {
        "prefix": {
          "description": "The token prefix is used to generate the custom properties for the given token.\nFor example, if prefix is \"color\", the token prefix will be \"color-\".\nIf the color tokens include a \"primary\" variant, the custom property generated will be\n\"--color-primary\".",
          "type": [
            "string",
            "null"
          ]
        },
        "source": {
          "description": "Path to the tokens file.\nIt will make it possible to override the default configuration for a given token.",
          "type": "string"
        },
        "utilities": {
          "description": "Utilities are used to generate utility classes for the given token.",
          "type": [
            "array",
            "null"
          ],
          "items": {
            "$ref": "#/$defs/TokenUtilityConfig"
          }
        }
      },
      "required": [
        "source"
      ]
    },
    "TokenUtilityConfig": {
      "description": "TokenUtilityConfig represents the configuration of a utility class for a given token.",
      "type": "object",
      "properties": {
        "prefix": {
          "description": "The prefix that will be used to generate the utility class.\nFor example, if the prefix is \"bg\", the utility class will be \"bg-[TOKEN VARIANT]\".",
          "type": "string",
          "minLength": 1
        },
        "property": {
          "description": "The CSS property that will use the design token value.",
          "type": "string",
          "minLength": 1
        }
      },
      "required": [
        "prefix",
        "property"
      ]
    }
  }
}